{
  "name": "corporate-classic",
  "palette": {
    "primary": "003E7E",
    "primary_soft": "DCEAF7",
    "accent": "C8A951",
    "accent_warn": "B8302D",
    "text_strong": "0A2540",
    "text": "1F1F1F",
    "text_muted": "5F5F5F",
    "background": "FFFFFF",
    "surface": "F0F4F8",
    "border": "C5D2E0"
  },
  "typography": {
    "font_family": "Microsoft YaHei",
    "size_pt": {
      "title": 28,
      "subtitle": 14,
      "h2": 14,
      "body": 11,
      "caption": 9,
      "badge": 9
    },
    "bold": {
      "title": true,
      "subtitle": false,
      "h2": true,
      "body": false,
      "caption": false,
      "badge": true
    },
    "color_role": {
      "title": "primary",
      "subtitle": "text_muted",
      "h2": "primary",
      "body": "text",
      "caption": "text_muted",
      "badge": "background"
    }
  },
  "spacing": {
    "slide_padding_emu": 457200,
    "card_padding_emu": 182880,
    "row_min_gap_emu": 182880,
    "col_min_gap_emu": 182880,
    "subtitle_gap_below_title_emu": 91440
  },
  "decoration": {
    "card_fill_role": "surface",
    "card_border_role": "primary",
    "card_border_pt": 0.75,
    "card_corner_radius_ratio": 0.02,
    "card_shadow": false,
    "badge_fill_role": "primary",
    "section_fill_role": "primary_soft",
    "connector_color_role": "primary",
    "connector_pt": 1.0
  }
}
