{
  "name": "editorial-dark",
  "palette": {
    "primary": "60A5FA",
    "primary_soft": "1E293B",
    "accent": "34D399",
    "accent_warn": "FBBF24",
    "text_strong": "F8FAFC",
    "text": "E2E8F0",
    "text_muted": "94A3B8",
    "background": "0F172A",
    "surface": "1E293B",
    "border": "334155"
  },
  "typography": {
    "font_family": "Microsoft YaHei",
    "size_pt": {
      "title": 32,
      "subtitle": 16,
      "h2": 14,
      "body": 11,
      "caption": 9,
      "badge": 9
    },
    "bold": {
      "title": true,
      "subtitle": false,
      "h2": true,
      "body": false,
      "caption": false,
      "badge": true
    },
    "color_role": {
      "title": "text_strong",
      "subtitle": "text_muted",
      "h2": "text_strong",
      "body": "text",
      "caption": "text_muted",
      "badge": "background"
    }
  },
  "spacing": {
    "slide_padding_emu": 457200,
    "card_padding_emu": 137160,
    "row_min_gap_emu": 137160,
    "col_min_gap_emu": 137160,
    "subtitle_gap_below_title_emu": 76200
  },
  "decoration": {
    "card_fill_role": "surface",
    "card_border_role": "border",
    "card_border_pt": 0.5,
    "card_corner_radius_ratio": 0.05,
    "card_shadow": false,
    "badge_fill_role": "primary",
    "section_fill_role": "primary_soft",
    "connector_color_role": "text_muted",
    "connector_pt": 1.0
  }
}
