{
  "name": "editorial-magazine",
  "palette": {
    "primary": "B8001F",
    "primary_soft": "F5E6E6",
    "accent": "C9A961",
    "accent_warn": "8B4513",
    "text_strong": "1F1F1F",
    "text": "404040",
    "text_muted": "707070",
    "background": "FAF6F0",
    "surface": "FFFFFF",
    "border": "D4C8B8"
  },
  "typography": {
    "font_family": "Microsoft YaHei",
    "size_pt": {
      "title": 48,
      "subtitle": 18,
      "h2": 18,
      "body": 12,
      "caption": 9,
      "badge": 10
    },
    "bold": {
      "title": true,
      "subtitle": false,
      "h2": true,
      "body": false,
      "caption": false,
      "badge": false
    },
    "color_role": {
      "title": "text_strong",
      "subtitle": "primary",
      "h2": "primary",
      "body": "text",
      "caption": "text_muted",
      "badge": "primary"
    }
  },
  "spacing": {
    "slide_padding_emu": 685800,
    "card_padding_emu": 228600,
    "row_min_gap_emu": 228600,
    "col_min_gap_emu": 228600,
    "subtitle_gap_below_title_emu": 137160
  },
  "decoration": {
    "card_fill_role": "surface",
    "card_border_role": "border",
    "card_border_pt": 0.25,
    "card_corner_radius_ratio": 0.0,
    "card_shadow": false,
    "badge_fill_role": "primary",
    "section_fill_role": "primary_soft",
    "connector_color_role": "text_muted",
    "connector_pt": 0.5
  }
}
