{
  "name": "business-warm",
  "palette": {
    "primary": "C2410C",
    "primary_soft": "FEF1E8",
    "accent": "0F766E",
    "accent_warn": "B45309",
    "text_strong": "171717",
    "text": "404040",
    "text_muted": "737373",
    "background": "FFFFFF",
    "surface": "FAF6F1",
    "border": "E5DDD0"
  },
  "typography": {
    "font_family": "Microsoft YaHei",
    "size_pt": {
      "title": 30,
      "subtitle": 16,
      "h2": 14,
      "body": 11,
      "caption": 9,
      "badge": 9
    },
    "bold": {
      "title": true,
      "subtitle": false,
      "h2": true,
      "body": false,
      "caption": false,
      "badge": true
    },
    "color_role": {
      "title": "text_strong",
      "subtitle": "text_muted",
      "h2": "primary",
      "body": "text",
      "caption": "text_muted",
      "badge": "background"
    }
  },
  "spacing": {
    "slide_padding_emu": 457200,
    "card_padding_emu": 137160,
    "row_min_gap_emu": 182880,
    "col_min_gap_emu": 182880,
    "subtitle_gap_below_title_emu": 91440
  },
  "decoration": {
    "card_fill_role": "surface",
    "card_border_role": "border",
    "card_border_pt": 0.75,
    "card_corner_radius_ratio": 0.06,
    "card_shadow": true,
    "badge_fill_role": "primary",
    "section_fill_role": "primary_soft",
    "connector_color_role": "text_muted",
    "connector_pt": 1.0
  }
}
