{
  "name": "pitch-deck",
  "palette": {
    "primary": "FF6B35",
    "primary_soft": "FFEDE5",
    "accent": "1A1A1A",
    "accent_warn": "FFC107",
    "text_strong": "0A0A0A",
    "text": "1F1F1F",
    "text_muted": "595959",
    "background": "FFFFFF",
    "surface": "F8F8F8",
    "border": "1A1A1A"
  },
  "typography": {
    "font_family": "Microsoft YaHei",
    "size_pt": {
      "title": 44,
      "subtitle": 20,
      "h2": 18,
      "body": 13,
      "caption": 10,
      "badge": 11
    },
    "bold": {
      "title": true,
      "subtitle": true,
      "h2": true,
      "body": false,
      "caption": false,
      "badge": true
    },
    "color_role": {
      "title": "text_strong",
      "subtitle": "primary",
      "h2": "text_strong",
      "body": "text",
      "caption": "text_muted",
      "badge": "background"
    }
  },
  "spacing": {
    "slide_padding_emu": 685800,
    "card_padding_emu": 274320,
    "row_min_gap_emu": 274320,
    "col_min_gap_emu": 274320,
    "subtitle_gap_below_title_emu": 137160
  },
  "decoration": {
    "card_fill_role": "background",
    "card_border_role": "border",
    "card_border_pt": 1.5,
    "card_corner_radius_ratio": 0.0,
    "card_shadow": false,
    "badge_fill_role": "primary",
    "section_fill_role": "primary_soft",
    "connector_color_role": "primary",
    "connector_pt": 1.5
  }
}
