{
  "name": "academic-soft",
  "palette": {
    "primary": "5B7C99",
    "primary_soft": "EAF1F8",
    "accent": "6B8E5A",
    "accent_warn": "C97D60",
    "text_strong": "1F1F1F",
    "text": "303030",
    "text_muted": "707070",
    "background": "FFFFFF",
    "surface": "FBF7EF",
    "border": "D9D2C2"
  },
  "typography": {
    "font_family": "Microsoft YaHei",
    "size_pt": {
      "title": 26,
      "subtitle": 14,
      "h2": 13,
      "body": 10,
      "caption": 8.5,
      "badge": 9
    },
    "bold": {
      "title": true,
      "subtitle": false,
      "h2": true,
      "body": false,
      "caption": false,
      "badge": true
    },
    "color_role": {
      "title": "text_strong",
      "subtitle": "text_muted",
      "h2": "text_strong",
      "body": "text",
      "caption": "text_muted",
      "badge": "background"
    }
  },
  "spacing": {
    "slide_padding_emu": 457200,
    "card_padding_emu": 137160,
    "row_min_gap_emu": 137160,
    "col_min_gap_emu": 137160,
    "subtitle_gap_below_title_emu": 76200
  },
  "decoration": {
    "card_fill_role": "surface",
    "card_border_role": "border",
    "card_border_pt": 0.5,
    "card_corner_radius_ratio": 0.04,
    "card_shadow": false,
    "badge_fill_role": "primary",
    "section_fill_role": "primary_soft",
    "connector_color_role": "text_muted",
    "connector_pt": 0.75
  }
}
